[
  {
    "name": "Acolyte",
    "source": "Player's Handbook",
    "abilityScores": [
      "Intelligence",
      "Wisdom",
      "Charisma"
    ],
    "feat": "Magic Initiate (Cleric)",
    "skillProficiencies": [
      "Insight",
      "Religion"
    ],
    "toolProficiency": [
      "Calligrapher's Supplies"
    ],
    "equipment": "Choose A or B: (A) Calligrapher’s Supplies, Book (prayers), Holy Symbol, Parchment (10 sheets), Robe, 8 GP; or (B) 50 GP",
    "description": "You devoted yourself to service in a temple, either nestled in a town or secluded in a sacred grove. There you performed rites in honor of a god or pantheon. You served under a priest and studied religion. Thanks to your priest's instruction and your own devotion, you also learned how to channel a modicum of divine power in service to your place of worship and the people who prayed there."
  },
  {
    "name": "Artisan",
    "source": "Player's Handbook",
    "abilityScores": [
      "Strength",
      "Dexterity",
      "Intelligence"
    ],
    "feat": "Crafter",
    "skillProficiencies": [
      "Investigation",
      "Persuasion"
    ],
    "toolProficiency": [
      "Choose one kind of Artisan’s Tools"
    ],
    "equipment": "Choose A or B: (A) Artisan's Tools (same as above), 2 Pouches, Traveler’s Clothes, 32 GP; or (B) 50 GP",
    "description": "You began mopping floors and scrubbing counters in an artisan’s workshop for a few coppers per day as soon as you were strong enough to carry a bucket. When you were old enough to apprentice, you learned to create basic crafts of your own, as well as how to sweet-talk the occasional demanding customer. Your trade has also given you a keen eye for detail."
  },
  {
    "name": "Charlatan",
    "source": "Player's Handbook",
    "abilityScores": [
      "Dexterity",
      "Constitution",
      "Charisma"
    ],
    "feat": "Skilled",
    "skillProficiencies": [
      "Deception",
      "Sleight of Hand"
    ],
    "toolProficiency": [
      "Forgery Kit"
    ],
    "equipment": "Choose A or B: (A) Forgery Kit, Costume, Fine Clothes, 15 GP; or (B) 50 GP",
    "description": "Once you were old enough to order an ale, you soon had a favorite stool in every tavern within ten miles of where you were born. As you traveled the circuit from public house to watering hole, you learned to prey on unfortunates who were in the market for a comforting lie or two—perhaps a sham potion or forged ancestry records."
  },
  {
    "name": "Criminal",
    "source": "Player's Handbook",
    "abilityScores": [
      "Dexterity",
      "Constitution",
      "Intelligence"
    ],
    "feat": "Alert",
    "skillProficiencies": [
      "Sleight of Hand",
      "Stealth"
    ],
    "toolProficiency": [
      "Thieves' Tools"
    ],
    "equipment": "Choose A or B: (A) 2 Daggers, Thieves' Tools, Crowbar, 2 Pouches, Traveler's Clothes, 16 GP; or (B) 50 GP",
    "description": "You eked out a living in dark alleyways, cutting purses or burgling shops. Perhaps you were part of a small gang of like-minded wrongdoers who looked out for each other. Or maybe you were a lone wolf, fending for yourself against the local thieves' guild and more fearsome lawbreakers."
  },
  {
    "name": "Entertainer",
    "source": "Player's Handbook",
    "abilityScores": [
      "Strength",
      "Dexterity",
      "Charisma"
    ],
    "feat": "Musician",
    "skillProficiencies": [
      "Acrobatics",
      "Performance"
    ],
    "toolProficiency": [
      "Choose one kind of Musical Instrument"
    ],
    "equipment": "Choose A or B: (A) Musical Instrument (same as above), 2 Costumes, Mirror, Perfume, Traveler’s Clothes, 11 GP; or (B) 50 GP",
    "description": "You spent much of your youth following roving fairs and carnivals, performing odd jobs for musicians and acrobats in exchange for lessons. You may have learned how to walk a tightrope, how to play a lute in a distinct style, or how to recite poetry with impeccable diction. To this day, you thrive on applause and long for the stage."
  },
  {
    "name": "Farmer",
    "source": "Player's Handbook",
    "abilityScores": [
      "Strength",
      "Constitution",
      "Wisdom"
    ],
    "feat": "Tough",
    "skillProficiencies": [
      "Animal Handling",
      "Nature"
    ],
    "toolProficiency": [
      "Carpenter's Tools"
    ],
    "equipment": "Choose A or B: (A) Sickle, Carpenter's Tools, Healer's Kit, Iron Pot, Shovel, Traveler's Clothes, 30 GP; or (B) 50 GP",
    "description": "You grew up close to the land. Years tending animals and cultivating the earth rewarded you with patience and good health. You have a keen appreciation for nature’s bounty alongside a healthy respect for nature's wrath."
  },
  {
    "name": "Guard",
    "source": "Player's Handbook",
    "abilityScores": [
      "Strength",
      "Intelligence",
      "Wisdom"
    ],
    "feat": "Alert",
    "skillProficiencies": [
      "Athletics",
      "Perception"
    ],
    "toolProficiency": [
      "Choose one kind of Gaming Set"
    ],
    "equipment": "Choose A or B: (A) Spear, Light Crossbow, 20 Bolts, Gaming Set (same as above), Hooded Lantern, Manacles, Quiver, Traveler’s Clothes, 12 GP; or (B) 50 GP",
    "description": "Your feet ache when you remember the countless hours you spent at your post in the tower. You were trained to keep one eye looking outside the wall, watching for marauders sweeping from the nearby forest, and your other eye looking inside the wall, searching for cutpurses and troublemakers."
  },
  {
    "name": "Guide",
    "source": "Player's Handbook",
    "abilityScores": [
      "Dexterity",
      "Constitution",
      "Wisdom"
    ],
    "feat": "Magic Initiate (Druid)",
    "skillProficiencies": [
      "Stealth",
      "Survival"
    ],
    "toolProficiency": [
      "Cartographer's Tools"
    ],
    "equipment": "Choose A or B: (A) Shortbow, 20 Arrows, Cartographer’s Tools, Bedroll, Quiver, Tent, Traveler's Clothes, 3 GP; or (B) 50 GP",
    "description": "You came of age outdoors, far from settled lands. Your home was anywhere you chose to spread your bedroll. There are wonders in the wilderness— strange monsters, pristine forests and streams, overgrown ruins of great halls once trod by giants— and you learned to fend for yourself as you explored them. From time to time, you guided friendly nature priests who instructed you in the fundamentals of channeling the magic of the wild."
  },
  {
    "name": "Hermit",
    "source": "Player's Handbook",
    "abilityScores": [
      "Constitution",
      "Wisdom",
      "Charisma"
    ],
    "feat": "Healer",
    "skillProficiencies": [
      "Medicine",
      "Religion"
    ],
    "toolProficiency": [
      "Herbalism Kit"
    ],
    "equipment": "Choose A or B: (A) Quarterstaff, Herbalism Kit, Bedroll, Book (philosophy), Lamp, Oil (3 flasks), Traveler's Clothes, 16 GP; or (B) 50 GP",
    "description": "You spent your early years secluded in a hut or monastery located well beyond the outskirts of the nearest settlement. In those days, your only companions were the creatures of the forest and those who would occasionally visit to bring news of the outside world and supplies. The solitude allowed you to spend many hours pondering the mysteries of creation."
  },
  {
    "name": "Merchant",
    "source": "Player's Handbook",
    "abilityScores": [
      "Constitution",
      "Intelligence",
      "Charisma"
    ],
    "feat": "Lucky",
    "skillProficiencies": [
      "Animal Handling",
      "Persuasion"
    ],
    "toolProficiency": [
      "Navigator's Tools"
    ],
    "equipment": "Choose A or B: (A) Navigator’s Tools, 2 Pouches, Traveler's Clothes, 22 GP; or (B) 50 GP",
    "description": "You were apprenticed to a trader, caravan master, or shopkeeper, learning the fundamentals of commerce. You traveled broadly, and you earned a living by buying and selling the raw materials artisans need to practice their craft or finished works from such crafters. You might have transported goods from one place to another (by ship, wagon, or caravan) or bought them from traveling traders and sold them in your own shop."
  },
  {
    "name": "Noble",
    "source": "Player's Handbook",
    "abilityScores": [
      "Strength",
      "Intelligence",
      "Charisma"
    ],
    "feat": "Skilled",
    "skillProficiencies": [
      "History",
      "Persuasion"
    ],
    "toolProficiency": [
      "Choose one kind of Gaming Set"
    ],
    "equipment": "Choose A or B: (A) Gaming Set (same as above), Fine Clothes, Perfume, 29 GP; or (B) 50 GP",
    "description": "You were raised in a castle, surrounded by wealth, power, and privilege. Your family of minor aristocrats ensured that you received a first-class education, some of which you appreciated and some of which you resented. Your time in the castle, especially the many hours you spent observing your family at court, also taught you a great deal about leadership."
  },
  {
    "name": "Sage",
    "source": "Player's Handbook",
    "abilityScores": [
      "Constitution",
      "Intelligence",
      "Wisdom"
    ],
    "feat": "Magic Initiate (Wizard)",
    "skillProficiencies": [
      "Arcana",
      "History"
    ],
    "toolProficiency": [
      "Calligrapher's Supplies"
    ],
    "equipment": "Choose A or B: (A) Quarterstaff, Calligrapher's Supplies, Book (history), Parchment (8 sheets), Robe, 8 GP; or (B) 50 GP",
    "description": "You spent your formative years traveling between manors and monasteries, performing various odd jobs and services in exchange for access to their libraries. You whiled away many a long evening studying books and scrolls, learning the lore of the multiverse - even the rudiments of magic - and your mind yearns for more."
  },
  {
    "name": "Sailor",
    "source": "Player's Handbook",
    "abilityScores": [
      "Strength",
      "Dexterity",
      "Wisdom"
    ],
    "feat": "Tavern Brawler",
    "skillProficiencies": [
      "Acrobatics",